Engagement	Location	Date	Result	Side 1	Leaders 1	Strength 1	Casualties 1	Side 2	Leaders 2	Strength 2	Casualties 2	Wikipedia Link
Attack on Pearl Harbor	Primarily Pearl Harbor, Hawaii Territory, U.S.	{{start date and age |1941|12|7}}	Major Japanese tactical victory; precipitated the Military history of the United States during World War II|entrance of the United States into World War II*See consequences of the attack on Pearl Harbor	{{flag|United States|1912}}	{{flagicon|United States Navy|1912}}	{{refn|USCGC|Taney|WHEC-37| |group|=|nb}}	{{refn|USS|Utah|BB-31|2| and |USS|Oglala|CM-4|2|group|=|nb}}	{{flag|Empire of Japan|name|=|Imperial Japan}}	{{flagicon|Empire of Japan|naval}}	'''Carrier Striking Task Force|Mobile Unit:'''6 aircraft carriers2 battleships2 heavy cruisers1 light cruiser9 destroyers8 tankers23 fleet submarines5 midget submarines414 aircraft	4 midget submarines sunk1 midget submarine grounded29 aircraft destroyed64 killed1 Kazuo Sakamaki|sailor capturedref{{Harvnb|Gilbert|2009|p=272}}.&lt;/ref&gt;	https://en.wikipedia.org/wiki/Attack_on_Pearl_Harbor
Battle of Guam (1941)	Guam, Mariana Islands, Pacific Ocean	8–10 December 1941	Japanese victory	{{flag|United States|1912}}	{{flagicon|USA|1912}}	'''Land:'''547 Marine (military)|marines and sailors'''Sea:'''1 Minesweeper (ship)|minesweeper2 patrol boats1 cargo ship|freighter	17 killed35 wounded406 captured1 minesweeper scuttled1 patrol boat scuttled1 patrol boat captured1 freighter damaged	{{flagcountry|Empire of Japan}}	{{flagicon|Empire of Japan|army}}	'''Land:'''5,900 infantry and marines'''Sea:'''4 heavy cruisers4 destroyers2 gunboats6 submarine chasers2 minesweepers2 Destroyer tender|tenders'''Air:'''unknown air forces	1 killed6 wounded1 aircraft destroyed	https://en.wikipedia.org/wiki/Battle_of_Guam_(1941)
Battle of Wake Island	Wake Island, U.S. territory	8–23 December 1941	Japanese pyrrhic victory	{{flagcountry|Empire of Japan}}	Shigeyoshi Inoue, Sadamichi Kajioka, Shigematsu Sakaibara, Eiji Gotō, Tamon Yamaguchi	'''First Attempt (11&nbsp;December):'''3 light cruisers 6 destroyers2 patrol boats2 troop transports'''Reinforcements arriving for Second Attempt (23&nbsp;December):''' 2 aircraft carriers2 heavy cruisers  2 destroyers  2,500 infantryrefNaval and air personnel not included.&lt;/ref&gt;	{{#tag:ref|USMC History estimates 21 aircraft shot down and 51 aircraft damaged by flak.|ref| name="The Defense of Wake"|{{cite web|title=The Defense of Wake|url=http://www.ibiblio.org/hyperwar/USMC/Wake/USMC-M-Wake-III.html|website=Ibiblio.org/}}||group|=|Note}}	{{flag|United States|1912}}	{{POW}}	449 USMC personnel consisting of: *399 infantry of the 1st Defense Battalion*50 VMF-211|det. VMF-2116 coastal artillery pieces, 12 aircraft, 12 anti-aircraft guns68 U.S. Navy personnel5 U.S. Army personnel	52 killed49 wounded2 missing12 aircraft lostrefMartin Gilbert, the Second World War (1989) pg 282&lt;/ref&gt;433 capturedref20 later died in captivity&lt;/ref&gt;	https://en.wikipedia.org/wiki/Battle_of_Wake_Island
Battle of Dutch Harbor	Dutch Harbor Naval Operating Base and Fort Mears, U.S. Army|Dutch Harbor Naval Operating Base and U.S. Army Fort Mears,, Dutch Harbor, Amaknak Island,, Aleutian Islands archipelago,, Alaska	3–4 June 1942	Japanese tactical victory	{{flag|United States|1912}}	Robert Alfred TheobaldSimon Bolivar Buckner, Jr.Archibald V. Arnold	37th Infantry Regiment (United States)|37th Infantry Regiment206th Field Artillery Regiment (United States)|206th Coast Artillery (AA)1 search light battery 6 anti-aircraft batteriesU.S. Marines|marines30 fighter aircraft|fighters	78 deadunknown wounded3 captured14 aircraft destroyedFort Mears moderately damagedDutch Harbor moderately damaged, 1 barracks ship destroyed	{{flagcountry|Empire of Japan}}	Kakuji Kakuta	2 light carrier|aircraft carriers3 cruisers5 destroyers40 fighters21 torpedo bombers21 dive bombers4 surveillance aircraft|reconnaissance aircraft	10 deadunknown wounded5 captured7 aircraft destroyedrefhttps://books.google.com.pe/books?id=p01bFVagOJYC&amp;pg=PA8&amp;lpg=PA8&amp;dq=Aleutian+Warriors+225+aircraft&amp;source=bl&amp;ots=njeUWFAgMi&amp;sig=sOwUK-bMKiwtQb-osKTOVuMQzvo&amp;hl=es-419&amp;sa=X&amp;ved=0ahUKEwjm3vz6g4fTAhVDQCYKHTAdDdcQ6AEIIDAB#v=onepage&amp;q=losses&amp;f=false Alaska at War, 1941&#8211;1945: The Forgotten War Remembered  ''p.394'']&lt;/ref&gt;	https://en.wikipedia.org/wiki/Battle_of_Dutch_Harbor
Japanese occupation of Kiska	Kiska, Aleutian Islands	6 June 1942 – 28 July 1943	Japanese victory	{{flag|United States|1912}}	Lieutenant|Lt. Mulls(Not present during initial landing)refhttp://www.hlswilliwaw.com/aleutians/Aleutians/html/wwii_kiska_navy_crew_listing.htm&lt;/ref&gt;	10-man weather station, 1-6 dogs, 3 aircraftrefhttp://www.hlswilliwaw.com/aleutians/Aleutians/html/wwii_kiska_navy_crew_listing.htm&lt;/ref&gt;	2 killed7 captured, 1 escaped (later surrendered)	{{flagcountry|Empire of Japan}}	{{flagicon|Empire of Japan}}	+500 Japanese Special Naval Landing Forces|Special Naval Landing Forces (Initial force)5,183-5,400 civilians and soldiers (Occupation)refhttp://www.pacificwrecks.com/provinces/alaska_kiska.html&lt;/ref&gt;	No casualties during initial capture, or during occupation/withdraw.	https://en.wikipedia.org/wiki/Japanese_occupation_of_Kiska
Japanese occupation of Attu	Attu Island|Attu, Aleutian Islands, Pacific Ocean	6 June 1942 – 30 May 1943	Japanese occupation commences.	{{flag|United States|1912}}	N/A	N/A	1 civilian killed46 civilians captured	{{flag|Empire of Japan}}	{{flagicon|Empire of Japan|army}}	1,140 - 2,900	unknown	https://en.wikipedia.org/wiki/Japanese_occupation_of_Attu
Battle of Hong Kong	British Hong Kong|Hong Kong	8–25 December 1941	Japanese victory&lt;!--Template:Infobox military conflict see result criterion for appropriate terms--&gt;	{{flag|United Kingdom}}	{{flagicon|UK}}	14,564 troops1 destroyer1 gunboat	{{efn|Figures taken from Christopher Maltby, the Commander British Forces in Hong Kong|sfn|Banham|2005|p|=|317}}	{{flagcountry|Empire of Japan}}	{{flagicon|Empire of Japan|army}}	29,700 troops47 planes1 cruiser3 destroyers4 torpedo boats3 gunboats	{{sfn|Ishiwari|1956|pp|=|47–48}}	https://en.wikipedia.org/wiki/Battle_of_Hong_Kong
Philippines Campaign (1941–42)	Philippines	8 December 1941 – 8 May 1942	Japanese victory	{{flagcountry|Empire of Japan}}	{{flagicon|Empire of Japan|army}}	129,435 troopsrefhttp://www.history.army.mil/books/wwii/MacArthur%20Reports/MacArthur%20V1/Images/p_002.jpg Reports of General MacArthur] Order of Battle plate. The total includes all elements of divisions assigned to the 14th Army at some point in the campaign, and replacements. The maximum strength of Japanese ground forces was approx. 100,000. The total does not include 12000+ Army air force personnel, whose totals were drastically reduced after 1 January 1942.&lt;/ref&gt;90 tanks541 aircraft	Japanese source:'''11,225''' 4,130 killed 287 missing 6,808 woundedref{{cite book|title=Senshi S&#333;sho (&#25126;&#21490;&#21474;&#26360;)|publisher=Asagumo Shimbunsha|language=Japanese|volume=2|year=1966}}&lt;/ref&gt;----Allied estimate: '''17,000–19,000'''ref{{cite book |date=3 October 2003 |title=Philippine Islands |url=http://www.history.army.mil/brochures/pi/PI.htm |publisher=Center of Military History, U.S. Army |page=19 |quote=Since 6 January the Japanese had suffered 7,000 battle casualties, with another 10,000 to 12,000 men dying of disease. }}&lt;/ref&gt;	{{flag|United States|1912}}	{{flagicon|USA|1912}}	151,000 troopsrefhttp://www.history.army.mil/books/wwii/5-2/5-2_2.htm#p25 The Fall of the Philippines] p. 18. The Philippine Army totalled 120,000 and the Army of the United States 31,000.&lt;/ref&gt;, 108 M3 Stuart|tanksref name="The Fall of the Philippines"http://www.history.army.mil/books/wwii/5-2/5-2_3.htm#p32 ''The Fall of the Philippines''], p.33.&lt;/ref&gt;, 277 aircraftrefhttp://www.history.army.mil/books/wwii/5-2/5-2_3.htm#p32 ''The Fall of the Philippines''], p.42. Total includes 175 fighters and 74 bombers.&lt;/ref&gt;	'''146,000''' 25,000 killed 21,000 wounded 100,000 capturedrefhttps://books.google.com/books?id=400EAAAAMBAJ&amp;printsec=frontcover&amp;source=gbs_hp#v=onepage&amp;q=&amp;f=false Life Magazine gives a total of 36,583 US/Filipino troops captured 9 April 1942]&lt;/ref&gt;	https://en.wikipedia.org/wiki/Philippines_Campaign_(1941–42)
Battle of Bataan	Bataan Peninsula near Manila Bay in Luzon|Luzon Island, Philippines	7 January – 9 April 1942, (3 months and 2 days)	Japanese victory, Bataan Death March	{{flag|United States|1912}}	{{flagicon|United States|1912}}	120,000 U.S. and Filipino troops	'''105,000''', 10,000 killed,20,000 wounded,76,000 imprisonedref name=imprisoned{{cite web |url=https://www.pbs.org/thewar/detail_5209.htm |title=The Philippines (Bataan) (1942) |author=&lt;!--Not stated--&gt; |date=2005 |website=The War |publisher=WETA |access-date= |quote= The 76,000 prisoners of war of the battle for Bataan - some 64,000 Filipino soldiers and 12,000 U.S. soldiers - then were forced to endure what came to be known as the Bataan Death March as they were moved into captivity.}}&lt;br/&gt;{{cite web |url=https://www.britannica.com/event/Bataan-Death-March |title=Bataan Death March |author=Elizabeth M. Norman |author2=Michael Norman |date=6 March 2017 |website=Encyclop&#230;dia Britannica |access-date= |quote=Bataan Death March, march in the Philippines of some 66 miles (106 km) that 76,000 prisoners of war (66,000 Filipinos, 10,000 U.S.) were forced by the Japanese military to endure in April 1942, during the early stages of World War II. }}&lt;br/&gt;{{cite news |url=http://news.mb.com.ph/2017/04/09/u-s-salutes-filipino-vets/ |title=U.S. salutes Filipino vets |author=Roy C. Mabasa |date=9 April 2017 |work=Manila Bulletin |access-date=9 April 2017 }}&lt;br/&gt;{{cite book|author=Eric Morris|title=Corregidor: The American Alamo of World War II|url=https://books.google.com/books?id=pA_OZODFKmkC&amp;pg=PA405|date=5 September 2000|publisher=Cooper Square Press|isbn=978-1-4616-6092-7|page=405}}&lt;br/&gt;{{cite book|author=Oliver L. North|title=War Stories II: Heroism in the Pacific|url=https://books.google.com/books?id=sgYHvMAgSyAC&amp;pg=PA326|date=28 March 2012|publisher=Regnery Publishing|isbn=978-1-59698-305-2|page=326}}&lt;/ref&gt;	{{flag|Empire of Japan|name|=|Japan}}	{{flagicon|Empire of Japan|name|=|Japan}}	75,000 Japanese troops	'''8,406'''ref{{cite book|title=Senshi S&#333;sho (&#25126;&#21490;&#21474;&#26360;)|publisher=Asagumo Shimbunsha|language=Japanese|volume=2|year=1966}}&lt;/ref&gt;-'''22,250'''ref{{cite book|author=Irvin Alexander|title=Surviving Bataan and Beyond: Colonel Irvin Alexander's Odyssey as a Japanese Prisoner of War|url=https://books.google.com/books?id=aWfqFW_OFmQC&amp;pg=PA272|date=April 2005|publisher=Stackpole Books|isbn=978-0-8117-3248-2|page=272}}&lt;br/&gt;{{cite book|author=Yuma Totani|title=Justice in Asia and the Pacific Region, 1945-1952|url=https://books.google.com/books?id=3RdoBgAAQBAJ&amp;pg=PA25|date=16 February 2015|publisher=Cambridge University Press|isbn=978-1-107-08762-0|page=25}}&lt;/ref&gt;, 3,107 killed,230 missing, 5,069 wounded,	https://en.wikipedia.org/wiki/Battle_of_Bataan
Battle of Corregidor	Corregidor island in Manila Bay, Luzon Island, Philippines	May 5–6, 1942	Japanese victory	{{flag|United States|1912}}	{{flagicon|United States|1912}}	13,000 U.S. and Filipino troops, 2 gunboats, and 1 minesweeper	800 killed1,000 wounded11,000 POWs1 gunboat sunk1 gunboat scuttled1 minesweeper scuttled	{{flagcountry|Empire of Japan}}	{{flagicon|Empire of Japan}}	75,000 Japanese troops	900 killed1,200 wounded	https://en.wikipedia.org/wiki/Battle_of_Corregidor
Dutch East Indies campaign	Dutch East Indies	8 December 1941 – 9 March 1942refDutch military commanders and the Governor-General surrendered on 9 March. (Adrian Vickers, (2005, ''A History Modern of Indonesia'', Cambridge; Cambridge University Press, p. 87.&lt;/ref&gt;	Japanese victory	{{flagicon|Netherlands}}	{{flagicon|UK}}	148,000 troopsrefDoes not include naval personnel&lt;/ref&gt;* 100,000 local troopsref name=chapter10{{cite web|url= http://www.ibiblio.org/hyperwar/AAF/I/AAF-I-10.html |title=Chapter 10: Loss of the Netherlands East Indies |accessdate=31 August 2010|work=The Army Air Forces in World War II: Vol. 1 &#8211; Plans &amp; Early Operations|publisher=HyperWar}}&lt;/ref&gt;* 40,000 Dutch troopsref name=chapter10{{cite web|url= http://www.ibiblio.org/hyperwar/AAF/I/AAF-I-10.html |title=Chapter 10: Loss of the Netherlands East Indies |accessdate=31 August 2010|work=The Army Air Forces in World War II: Vol. 1 &#8211; Plans &amp; Early Operations|publisher=HyperWar}}&lt;/ref&gt;* 8,000 Anglo-American troopsref name="subversionasforeignpolicy"George McTurnan Kahin and Adrian Kahin, ''Subversion as Foreign Policy'', New York: The New Press, 1995 ({{ISBN|1565842448}}), Pp 22&lt;/ref&gt;33 warshipsref name="Morison 1948 pp. 158, 271"Morison (1948), pp. 158, 271&amp;ndash;273, 293 and 311&lt;/ref&gt;41 submarinesref name="submarinewar"{{cite web|url= http://www.dutcheastindies.webs.com/under_sea.html |title=Submarine War in the Dutch East Indies (1941-1942)|accessdate=31 August 2010|date=1999&#8211;2000|work= |publisher=Dutch East Indies Campaign website}}&lt;/ref&gt;234 aircraftref name=chapter10{{cite web|url= http://www.ibiblio.org/hyperwar/AAF/I/AAF-I-10.html |title=Chapter 10: Loss of the Netherlands East Indies |accessdate=31 August 2010|work=The Army Air Forces in World War II: Vol. 1 &#8211; Plans &amp; Early Operations|publisher=HyperWar}}&lt;/ref&gt;	2,384 killed, 100,000+ capturedrefhttp://www.history.army.mil/books/amh-v2/amh%20v2/chapter3.htm "WORLD WAR II: THE DEFENSIVE PHASE"], US Army Center Of Military History, p. 87&lt;/ref&gt;	{{Flagcountry|Empire of Japan}}	{{flagicon|Empire of Japan|army}}	52 warshipsrefMorison (1948), pp. 274&amp;ndash; 276, 296, 384&lt;/ref&gt;ref name="Morison 1948, pp. 275&#8211;276"Morison (1948), pp. 275&amp;ndash;276&lt;/ref&gt;18 submarinesref name= "submarinewar"107,800 personnel, 193 tanks and tankettes, 2,017 artillery pieces, 5,898 motor vehicles, 11,750 horses609 aircraftrefhttps://openaccess.leidenuniv.nl/bit...pdf?sequence=1 The Invasion of the Dutch East Indies] p. 95, 98, 417. Retrieved 11/21/2017&lt;/ref&gt;	671 killedrefFrancis Pike, https://books.google.com/books?id=2IYQCAAAQBAJ&amp;pg=PA309&amp;dq=surrendered+east+indies+campaign&amp;hl=en&amp;sa=X&amp;ved=0ahUKEwju4OKpgePLAhUOx2MKHaA1CJkQ6AEILTAD#v=onepage&amp;q=surrendered%20east%20indies%20campaign&amp;f=false "Hirohito's War: The Pacific War, 1941-1945"], 2015, p. 309.&lt;/ref&gt;	https://en.wikipedia.org/wiki/Dutch_East_Indies_campaign
Battle of Borneo (1941–42)	Borneo|Borneo Island	16 December 1941 – March 1942	Japanese victory	{{flag|Empire of Japan}}	{{flagdeco|Empire of Japan|army}}	4,500 infantry, 2 heavy cruisers, 1 light cruiser, 6 destroyers, 1 submarine chaser, 1 seaplane tender, 1 minesweeper, 1 submarine, 1 collier, 10 transports	567+ casualties, 2 destroyers sunk, 1 minesweeper sunk, 1 collier sunk, 2 transports sunk, 1 transport beached, 1 transport damaged	{{flag|United Kingdom}}	{{flagdeco|United Kingdom}}	1,000 Sarawak Force1,000 British Punjab Regiment1,000 KNIL650 police5 fighters, Unknown bomber strength, 3 flying boats, 2 submarines	2,300 casualties, 1 flying boat destroyed, 1 submarine sunk	https://en.wikipedia.org/wiki/Battle_of_Borneo_(1941–42)
Battle of Manado	Manado, Northern Celebes island	11–13 January 1942	Japanese victory	File:Flag of the Netherlands.svg|25px Netherlands	{{Flagicon|Netherlands}}	1,500 infantry	140 killed48 captured	{{Flagcountry|Empire of Japan}}	{{flagicon|Empire of Japan|naval}}	2,500 naval infantry500 paratroopers20 aircraft	32 killed32 wounded	https://en.wikipedia.org/wiki/Battle_of_Manado
Battle of Tarakan (1942)	Tarakan Island, northeastern Borneo island	January 11–12, 1942	Japanese victory	{{flagcountry|Empire of Japan}}	{{flagicon|Empire of Japan|army}}	Over 6,600	255 killed	{{flag|Netherlands}}	{{Flag icon|Netherlands}}	Over 1,300	Unknown number killed in battle. 219 executed after surrendering.,  871 prisoners.	https://en.wikipedia.org/wiki/Battle_of_Tarakan_(1942)
Battle of Balikpapan (1942)	Balikpapan, Borneo	23–24 January 1942	Japanese land victory, Allied tactical naval victory	{{flag|Netherlands}}	{{flagicon|Netherlands}}	'''Land:'''1,100 infantry'''Sea:'''4 destroyers 1 submarine'''Air:'''29 aircraft	'''Land:''', Unknown,  '''Sea:''', 1 destroyer lightly damaged,  1 submarine heavily damaged	{{flagcountry|Empire of Japan}}	{{flagicon|Empire of Japan}}	'''Land:'''5,500 infantry,1,100 naval infantry|sailors'''Sea:'''3 patrol boats,12 transport (ship)|transports	'''Land:''', Unknown,  '''Sea:''', 50+ casualties1 patrol boat sunk,6 transports sunk	https://en.wikipedia.org/wiki/Battle_of_Balikpapan_(1942)
Battle of Ambon	Ambon Island|Ambon, Maluku Islands|Moluccas, Netherlands East Indies	30 January-3 February 1942	Japanese victory	{{flag|Netherlands}}	{{flagicon|Netherlands}}	3,900, 2 aircraft	'''Netherlands:''', Unknown'''Australia:'''15 killed35 wounded'''US:'''Unknown	{{flagcountry|Empire of Japan}}	{{flagicon|Empire of Japan|naval}}	5,300, 10 aircraft	55 killed, 135 wounded	https://en.wikipedia.org/wiki/Battle_of_Ambon
Battle of Makassar Strait	Java Sea, Dutch East Indies	4 February 1942	Japanese victory	{{flag|Netherlands}}	{{flagicon|Netherlands}}	4 cruisers7 destroyers	70 sailors killed, 2 cruisers damaged	{{flagicon|Empire of Japan}}	{{flagicon|Empire of Japan|naval}}	37–45 planes (Allied estimate)60 land based bombers (Japanese reports)	4+ planes destroyed	https://en.wikipedia.org/wiki/Battle_of_Makassar_Strait
Battle of Palembang	Palembang, southern part of Sumatra island	13–15 February 1942	Japanese victory	{{flag|United Kingdom}}	Air Commodore|Air Cmdr. Henry John Francis Hunter|H. J. F. Hunter (bombers), Air Cmdr. Stanley Flamank Vincent|S. F. Vincent (fighters), Lt. Col. L. N. W. Vogelesang (ground forces)	2,000 infantry  50 aircraft	Allies: ?	{{flagcountry|Empire of Japan}}	Vice Admiral|V. Adm. Jisaburo Ozawa (amphibious forces), Col. Yoshisaburô Tanaka, Col. Seiichi Kume (paratroopers)	3,000 amphibious force,  350 paratroopers, 3 squadrons transports1 bomber group, 2 fighter groups	Japan: ?	https://en.wikipedia.org/wiki/Battle_of_Palembang
Battle of Badung Strait	Badung Strait off Bali in the Dutch East Indies	18–20 February 1942	Japanese victory	{{flag|Netherlands}}	{{flagicon|Netherlands}}	'''Sea:'''3 cruisers,7 destroyers,2 submarines'''Air:'''20 aircraft	Unknown human losses1 destroyer sunk,1 cruiser damaged,1 destroyer damaged	{{flagcountry|Empire of Japan}}	{{flagicon|Empire of Japan|naval}}	4 destroyers,2 Transport (ship)|transports	25 killed,~83 wounded,3 destroyers damaged, 1 transport damaged	https://en.wikipedia.org/wiki/Battle_of_Badung_Strait
Battle of Timor	West Timor|Dutch Timor and Portuguese Timor (present-day East Timor)	19 February 1942 – 10 February 1943	Japanese tactical victoryAllied strategic victory	{{flag|Australia}}	{{flagicon|Australia}}	~ 2,050 strong garrison(peak February 1942)~ 1,000 commandos(peak October 1942)	'''Netherlands:'''~ 300 dead'''Australia:'''151 dead (Sparrow Force)'''Portugal:'''~ 75 dead'''United Kingdom:'''5 dead The Sparrows (Military Unit)|(''The Sparrows'')ref name=ASNCE{{cite web |title=A Short History of East Timor|publisher=Department of Defence|year=2002|url= http://www.defence.gov.au/army/asnce/history.htm|accessdate=3 January 2007|archiveurl= https://web.archive.org/web/20060103133824/http://www.defence.gov.au/army/asnce/history.htm| archivedate=3 January 2006}}&lt;/ref&gt;	{{flagicon|Empire of Japan}}	{{Flagicon|Empire of Japan}}	~ 12,000 (peak late 1942)	~ 4,000 dead (West & East Timor)	https://en.wikipedia.org/wiki/Battle_of_Timor
Battle of the Java Sea	Java Sea	27 February 1942	Decisive Japanese victory	{{flag|Netherlands}}	{{flagicon|NLD}}	2 heavy cruisers3 light cruisers9 destroyers	2 light cruisers sunk3 destroyers sunk1 heavy cruiser damaged, 2,300 sailors killed	{{flagcountry|Empire of Japan}}	{{flagicon|Empire of Japan|naval}}	2 heavy cruisers2 light cruisers14 destroyers, 10 transports	1 destroyer damaged, 36 sailors killed	https://en.wikipedia.org/wiki/Battle_of_the_Java_Sea
Battle of Sunda Strait	Sunda Strait, Netherlands East Indies	28 February – 1 March 1942	Japanese victory	{{flag|United States|1912}}	{{flagicon|UK|naval}}	'''American:'''1 heavy cruiser'''Australian:'''1 light cruiser'''Dutch:'''1 destroyer	1 heavy cruiser sunk1 light cruiser sunk1 destroyer sunk1071 killed675 POWsref name="Order of Battle"{{citation| title = Order of Battle| url = http://www.navweaps.com/index_oob/OOB_WWII_Pacific/OOB_WWII_Sunda_Strait.htm}}&lt;/ref&gt;	{{flagcountry|Empire of Japan}}	{{flagicon|Empire of Japan|naval}}	1 light carrier1 seaplane carrier5 cruisers12 destroyers1 minelayer58 troopships	1 minelayer sunk,4 troopships sunk or grounded,ref name="Order of Battle" 1 cruiser damaged,10 killed,37 woundedref name="ReferenceA"Dull. ''A Battle History of the Imperial Japanese Navy''&lt;/ref&gt;	https://en.wikipedia.org/wiki/Battle_of_Sunda_Strait
Battle of Java (1942)	Java (island)|Java, Dutch East Indies	28 February – 12 March 1942	Japanese victory	{{flag|Netherlands}}	{{flagicon|Netherlands}}	Netherlands: 25,000; Britain: about 5,500; Australia: about 3,000; U.S.: about 750, , Total: about 34,250 troops	Netherlands: ? Britain: ? Australia: 36 dead, 60 wounded; U.S.: US Army 24 KIA; 534 POWUS Navy 801 KIA; 369 POW. US Navy casualties: USS ''Houston'' and ''Asheville'' Of POWS 164 died (Army & Navy).	{{nowrap|flagcountry|Empire of Japan}}	{{flagicon|Empire of Japan|army}}	about 34,000 troops	Unknown	https://en.wikipedia.org/wiki/Battle_of_Java_(1942)
Second Battle of the Java Sea	Java Sea	1 March 1942	Japanese victory	{{flagicon|United Kingdom|naval}}	{{flagicon|United Kingdom|naval}}	1 heavy cruiser2 destroyers	1 heavy cruiser sunk2 destroyers sunk, 800 captured	{{flagicon|Japan|naval}}	{{flagicon|Japan|naval}}	4 heavy cruisers5 destroyers	1 destroyer heavily damaged	https://en.wikipedia.org/wiki/Second_Battle_of_the_Java_Sea
Battle of Rabaul (1942)	Rabaul, New BritainTerritory of New Guinea	23 January&nbsp;– February 1942	Japanese victory	{{flag|Australia}}	{{flagicon|Australia}}	1,400 soldiers (New Britain)  130 soldiers (New Ireland)	6 aircrew killed, 5 wounded  28 soldiers killed in action  ~1,000 captured	{{flagcountry|Empire of Japan}}	{{flagicon|Empire of Japan|naval}}	5,000 soldiers (New Britain)  3,000&nbsp;– 4,000 soldiers (New Ireland)	16 killed, 49 wounded	https://en.wikipedia.org/wiki/Battle_of_Rabaul_(1942)
Bombing of Darwin	Darwin, Northern Territory, Australia	19 February 1942	Japanese victory	{{flag|Australia}}	{{nowrap|flagicon|Australia| David Blake (general)|David V. J. Blake}}	31 aircraft18 A/A Guns1 Destroyer1 Seaplane Tender2 Sloops4 Minesweeper/Corvettes4 Boom Defence Vessels9 Merchant ships/Transports1 Hospital Ship23 Auxiliary vessels12 Pearling luggers	236 killedref name="ReferenceA"ref{{cite web|url=http://www.ntlexhibit.nt.gov.au/exhibits/show/bod |title=Northern Territory Library &amp;#124; Summary of Roll of Honour |publisher=Ntlexhibit.nt.gov.au |date=1942-02-19 |accessdate=2014-02-19}}&lt;/ref&gt;, 300–400 wounded30 aircraft destroyedref name="ReferenceA", 11 vessels sunk, 3 vessels grounded25 ships damaged	{{flagcountry|Empire of Japan}}	{{flagicon|Empire of Japan|naval}}	242 aircraft4 Aircraft Carriers2 Heavy cruisers1 Light Cruiser7 Destroyers3 Submarines	2 killed ref name="ReferenceB"Takezo Uchikado and Katsuyoshi Tsuru were killed when their Val dive bomber crashed near Darwin. Hajime Toyoshima was taken prisoner when his Zero crashed on Bathurst Island. The Zero of Yoshio Egawa and the Val dive bomber of Takeshi Yamada and Kinji Funazaki, ditched upon returning to the carriers.&lt;/ref&gt;, Hajime Toyoshima|1 POW, 4 aircraft destroyedref name="ReferenceA"	https://en.wikipedia.org/wiki/Bombing_of_Darwin
Attack on Broome	Broome, Western Australia|Broome, Australia	3 March 1942	Japanese victory	{{flag|Australia}}	{{flagicon|Australia}}	22 aircraft	88 killed (official toll)22 aircraft destroyed	{{flagicon|Empire of Japan}}	{{flagicon|Empire of Japan}}	10 aircraft	1 killed (official toll)2 aircraft destroyed	https://en.wikipedia.org/wiki/Attack_on_Broome
Attack on Sydney Harbour	Sydney Harbour, Sydney, New South Wales, Australia	31 May – 8 June 1942	Indecisive	{{flag|Australia}}	Gerard Muirhead-Gould	2 heavy cruisers,1 light cruiser,2 armed merchant cruisers,2 destroyers,3 corvettes,1 submarine,2 anti-submarine vessels,6 channel patrol boats	1 depot ship sunk,21 killed,10 woundedref{{cite web|last=Nichols|first=Robert|title=Sydney Under Attack: Japanese Midget Submarine 31 May &#8211; 1 June 1942 |url=http://www.awm.gov.au/atwar/remembering1942/midget_submarine/transcript.asp |work=Remembering 1942 |publisher=Australian War Memorial |accessdate=9 February 2014 |date=31 May 2002}}&lt;/ref&gt;	{{flagcountry|Empire of Japan}}	Hankyu Sasaki	5 fleet submarines,3 midget submarines,2 seaplanes	2 midget submarines sunk,1 midget submarine scuttled,2 spotter planes lost,6 killed	https://en.wikipedia.org/wiki/Attack_on_Sydney_Harbour
Raid on Darwin (2 May 1943)	Darwin, Northern Territory	2 May 1943	Indecisive	{{flagcountry|Empire of Japan}}	{{flagicon|Empire of Japan}}	27 Mitsubishi A6M Zero|Zero fighters, 25 bombers	6-10 aircraft destroyed, 8 aircraft damaged	{{flag|Australia}}	{{flagicon|Australia}}	33 Spitfire fighters, Darwin anti-aircraft guns	2 pilots killed, 1 soldier killed, 14 Spitfires destroyed or damaged, Minor damage to buildings	https://en.wikipedia.org/wiki/Raid_on_Darwin_(2_May_1943)
