Engagement	Location	Date	Result	Side 1	Leaders 1	Strength 1	Casualties 1	Side 2	Leaders 2	Strength 2	Casualties 2	Wikipedia Link
Battle of Tarawa	Betio|Betio Island, Tarawa|Tarawa Atoll, Gilbert Islands	20–23 November 1943	United States victory	{{flag|United States|1912}}	U.S. Navy:, Raymond A. Spruance|Raym. A. Spruance, Richmond K. Turner, Harry W. Hill, U.S. Marine Corps:, Holland Smith|Holland M. Smith, Julian C. Smith, Leo D. Hermle, Merritt Edson|Merritt A. Edson, David M. Shoup	35,000 troops,  18,000 Marinesref{{cite web| url=http://www.history.com/topics/world-war-ii/battle-of-tarawa | work=History.com staff | title=Battle of Tarawa | date=16 February 2016}}&lt;/ref&gt;	{{sfn|Wright|2004|p|=|93}}	{{flagcountry|Empire of Japan}}	{{KIA}}	2,636 troops,  2,200 construction laborers (1,000 Japanese and 1,200 Korean), 14 tanks , 40 artillery pieces, 14 naval guns	4,690 killed  17 soldiers captured  129 laborers captured	https://en.wikipedia.org/wiki/Battle_of_Tarawa
Battle of Kwajalein	Kwajalein Atoll, Marshall Islands	31 January–3 February 1944	United States victory	{{flag|United States|1912}}	Richmond K. Turner|Richmond K. Turner (USN), Holland M. Smith|Holland M. Smith (USMC), Harry Schmidt (USMC)|Harry Schmidt (USMC), Charles H. Corlett|Charles H. Corlett (USA), Thomas E. Watson (USMC)|Thomas E. Watson (USMC)	{{rp|27–28}}	{{rp|88}}	{{flagcountry|Empire of Japan}}	{{KIA}}	{{rp|31}}	{{rp|88}}	https://en.wikipedia.org/wiki/Battle_of_Kwajalein
Battle of Eniwetok	Eniwetok Atoll, Marshall Islands	17 February &ndash; 23 February 1944	United States victory	{{flag|United States|1912}}	Harry W. Hill|Harry W. Hill (USN), John T. Walker (USMC)|John T. Walker (USMC), Thomas E. Watson (USMC)|Thomas E. Watson (USMC)	2 regiments-22nd Marine Regiment (United States)|22nd Marine Regiment (USMC)-106th Infantry Regiment (United States)|106th Infantry Regiment (USA)	{{rp|88}}	{{flagcountry|Empire of Japan}}	{{KIA}}	{{rp|32}}	{{rp|88}}	https://en.wikipedia.org/wiki/Battle_of_Eniwetok
Mariana and Palau Islands campaign	Mariana Islands|Mariana and Palau Islands, Pacific Ocean	June – November, 1944	U.S. victory	{{flag|United States|1912}}	Chester Nimitz, Raymond A. Spruance, Richmond K. Turner, Holland Smith, Roy Geiger, Harry Schmidt (USMC)|Harry Schmidt, William H. Rupertus, Paul J. Mueller	128,000  600+ ships	9,500 killed	{{flagcountry|Empire of Japan}}	{{KIA}}	71,000	67,000+ killed	https://en.wikipedia.org/wiki/Mariana_and_Palau_Islands_campaign
Battle of Saipan	Saipan, Mariana Islands	15 June – 9 July 19443 weeks, 3 days	American victory	{{flag|United States|1912}}	Richmond K. Turner, Holland Smith	71,000	{{rp|379}}	{{flagcountry|Empire of Japan}}	{{KIA}}	{{rp|563}}	{{citation needed|date|=|March 2017}}	https://en.wikipedia.org/wiki/Battle_of_Saipan
Battle of the Philippine Sea	The Philippine Sea	June 19–20, 1944	Decisive American victoryref{{harvnb|Crowl|1995|p=441}}&lt;/ref&gt;	{{flag|United States|1912}}	{{flagicon|USA|1912}}	7 fleet carriers 8 light carriers 7 battleships 8 heavy cruisers  13 light cruisers 68 destroyers 28 submarines ~900 carrier aircraft	1 battleship damaged123 aircraft destroyedref name="Shores"{{harvnb|Shores|1985|p=205}}&lt;/ref&gt;109 dead	{{flagcountry|Empire of Japan}}	{{flagicon|Empire of Japan|naval}}	5 fleet carriers 4 light carriers 5 battleships 11 heavy cruisers  2 light cruisers 31 destroyers 24 submarines 6 oilers ~450 carrier aircraft ~300 land-based aircraft	{{ship|Japanese aircraft carrier|Taihō|2}}	https://en.wikipedia.org/wiki/Battle_of_the_Philippine_Sea
Battle of Guam (1944)	Guam, Mariana Islands	21 July – 10 August 1944	American victory* Guam is liberated from Japanese Empire|Japan by the United States	{{flag|United States|1912}}	Roy Geiger, Richmond K. Turner, Holland Smith, Allen H. Turnage, Andrew D. Bruce	{{rp|37,39}}	1,777 killed, 5,798 wounded, 23 missingref{{cite web|url=https://www.nps.gov/wapa/learn/historyculture/guam-armed-forces-casualties.htm |title=Casualty List - U.S. Armed Forces - 1944 |publisher=National Park Service, War in the Pacific National Historical Park, Guam |date= |accessdate=8 March 2017}}&lt;/ref&gt;	{{flagcountry|Empire of Japan}}	{{KIA}}	{{rp|23}}	{{rp|87}}	https://en.wikipedia.org/wiki/Battle_of_Guam_(1944)
Battle of Tinian	Tinian, Mariana Islands	24 July&nbsp;– 1 August 1944	American victory	{{flag|United States|1912}}	{{flagicon|United States|1912}}	{{rp|34}}	{{rp|88}}	{{flagcountry|Empire of Japan}}	{{flagicon|Empire of Japan}}	{{rp|89}}	{{rp|88}}	https://en.wikipedia.org/wiki/Battle_of_Tinian
Battle of Peleliu	Peleliu, Palau Islands	15 September – 27 November 1944	Allies of World War II|Allied victory	{{flag|United States|1912}}	{{flagicon|USA|1912}}	{{rp|36}}	2,336 killed8,450 woundedref name="stamfordhistory.org"http://www.stamfordhistory.org/ww2_peleliu.htm The Stamford Historical Society: Peleliu] Retrieved 27 Oct. 2015&lt;/ref&gt;	{{flagcountry|Empire of Japan}}	{{flagicon|Empire of Japan|army}}	{{rp|37}}	{{rp|89}}	https://en.wikipedia.org/wiki/Battle_of_Peleliu
Battle of Angaur	Angaur, Palau Islands	17 September–22 October 1944	American victory	{{flag|United States|1912}}	{{flagicon|United States|1912}}	10,000	{{rp|89}}	{{nowrap|flagcountry|Empire of Japan}}	{{flagicon|Empire of Japan}}	{{rp|89}}	{{rp|89}}	https://en.wikipedia.org/wiki/Battle_of_Angaur
Battle of Noemfoor	Dutch New Guinea	2 July – 31 August 1944	Allied victory	{{flagu|United States|1912}}	{{flagicon|United States|1912}}	10,000	66 killed/missing;343 wounded	{{flagicon|Empire of Japan}}	{{flagicon|Empire of Japan}}	2,000 (US estimates)	~1,714 killed;186 prisoners	https://en.wikipedia.org/wiki/Battle_of_Noemfoor
Battle of Morotai	Morotai, off North Halmahera, Maluku Islands	15 September – 4 October 1944 (initial period), intermittent fighting continued until the end of the war	Allied victory	{{flag|United States|1912}}	Clarence Martin (land)Daniel E. Barbey (naval)	57,020 (initial force)		{{flagcountry|Empire of Japan}}	{{POW}}	~500 at the time of, the Allied invasion,, later reinforced		https://en.wikipedia.org/wiki/Battle_of_Morotai
Philippines Campaign (1944–1945)	Philippines	October 20, 1944 – September 2, 1945	Allied victory	{{flag|United States|1912}}	{{flagdeco|United States|1912}}	{{flagicon|United States|1912}}	{{flagicon|United States|1912}}	{{flagcountry|Empire of Japan}}	{{flagdeco|Empire of Japan}}	{{flagicon|Empire of Japan}}	{{flagicon|Empire of Japan}}	https://en.wikipedia.org/wiki/Philippines_Campaign_(1944–1945)
Battle of Leyte	Leyte Island, Philippines	{{rp|324}}	Decisive Allied victory	{{flag|United States|1912}}	{{flagicon|United States|1912}}	{{flagicon|United States|1912}}	{{rp|337}}	{{flagcountry|Empire of Japan}}	{{flagicon|Empire of Japan}}	{{flagicon|Japan}}	49,000 deadrefhttp://www.history.army.mil/brochures/leyte/leyte.htm "Leyte:" US Army Official History] Retrieved 27 Oct. 2015&lt;/ref&gt;	https://en.wikipedia.org/wiki/Battle_of_Leyte
Battle of Leyte Gulf	Leyte Gulf, Philippines	23–26 October 1944	Decisive Allied victory*Japanese naval capabilities crippled	{{Flag|United States|1912}}	{{Flagicon|United States|1912}}	'''~300 ships in total'''ref name="Morison1956"{{cite book | chapter = Leyte, June 1944 &#8211; January 1945 | title=History of United States Naval Operations in World War II | volume=XII | last=Morison | first=Samuel E. | authorlink=Samuel Eliot Morison | year=1956 | publisher=Little &amp; Brown | location=Boston | isbn= | pages= | url= }}&lt;/ref&gt;8 fleet aircraft carrier|carriers8 Light aircraft carrier|light carriers18 escort carriers12 battleships24 cruisers166 destroyers and destroyer escortsMany PT boats, submarines, and fleet auxiliariesAbout 1,500 Aircraft|planes	~3,000 casualties; 1 light carrier,2 escort carriers, 2 destroyers, 1 destroyer escort sunk  200+ planes	{{Flagcountry|Empire of Japan}}	{{Flagicon|Empire of Japan|naval}}	'''67+ ships in total'''1 fleet Japanese aircraft carrier Zuikaku|carrier3 light carriers9 battleships14 heavy cruisers6 light cruisers35+ destroyers300+ planes (including land-based aircraft)ref{{cite book|last=Thomas|first=Evan|title=Sea of Thunder|year=2006|publisher=Simon &amp; Schuster|location=New York, NY|isbn=978-0-7432-5221-8|pages=209&#8211;210}}&lt;/ref&gt;	~12,500 casualties; 1 fleet carrier, 3 light carriers3 battleships, 10 cruisers, 11 destroyers sunk  ~300 planesref{{cite book|last=Thomas|first=Evan|title=Sea of Thunder|year=2006|publisher=Simon &amp; Schuster|location=New York, NY|isbn=978-0-7432-5221-8|page=322}}&lt;/ref&gt;	https://en.wikipedia.org/wiki/Battle_of_Leyte_Gulf
Battle off Samar	East of Samar Island	October 25, 1944	American victory	{{flag|United States|1912}}	{{flagicon|USA|1912}}	"Taffy 3", 6 escort carriers,, 3 destroyers,, 4 destroyer escorts,, 400 aircraft from Taffy 1, 2, 3	2 escort carriers sunk, 2 destroyers sunk, 1 destroyer escort sunk,  23 aircraft lost, 3 escort carriers damaged ,  1 destroyer damaged ,  2 destroyer escorts damaged ,  1,583 killed and missing, 913 wounded	{{flagcountry|Empire of Japan}}	{{flagicon|Empire of Japan|naval}}	Japanese Center Force, 4 battleships,, 6 heavy cruisers,, 2 light cruisers,, 11 destroyers,,  30 aircraft (in ''kamikaze'' attack)	3 heavy cruisers sunk, 3 heavy cruisers damaged, 1 destroyer damaged, 52 aircraftref{{cite web|url= http://www.bosamar.com/pages/ctu7741_action_report |title=Action Report &#8211; Leyte Operation from 12 October to 29 October 1944, p.31|publisher= United States Pacific Fleet Carrier Division 22 via bosamar.com|date=n.d.|accessdate=June 9, 2012}}&lt;/ref&gt;, Unknown number	https://en.wikipedia.org/wiki/Battle_off_Samar
Battle of Luzon	Luzon, Philippines	January 9th, 1945 – August 15th, 1945	Allied victory	{{flag|United States|1912}}	{{flagicon|United States|1912}}	280,000refManchester: American Caesar pg. 406&lt;/ref&gt;	{{flagicon|United States|1912}}	{{flagcountry|Empire of Japan}}	{{flagicon|Empire of Japan}}	275,000refManchester: American Ceaser pg. 406&lt;/ref&gt;, 232 tanksrefTaki, http://www3.plala.or.jp/takihome/history2.htm THE HISTORY OF BATTLES OF IMPERIAL JAPANESE TANKS].&lt;/ref&gt;	{{flagicon|Empire of Japan}}	https://en.wikipedia.org/wiki/Battle_of_Luzon
Battle of Manila (1945)	Manila, Philippines	3 February – 3 March 1945	Allied victory* End of the Japanese military rule* Restoration of the Commonwealth of the Philippines|Philippine Commonwealth	{{flag|United States|1912}}	{{flagicon|United States|1912}}	35,000 US troops3,000 Filipino guerrillas	{{rp|195}}	{{flagcountry|Empire of Japan}}	{{flagicon|Empire of Japan|naval}}	{{rp|73}}	{{rp|174}}	https://en.wikipedia.org/wiki/Battle_of_Manila_(1945)
